DID,STOCK_ITEM_ID,CREATED_DATE,CATEGORY,REGISTRATION,REG_CODE,MAKE,MODEL,DERIVATIVE,ATTENTION_GRABBER,ENGINE_SIZE,ENGINE_SIZE_UNIT,FUEL_TYPE,MANUFACTURED_YEAR,MILEAGE,MILEAGE_UNIT,BODYTYPE,COLOUR,TRANSMISSION,DOORS,PREVIOUS_OWNERS,PRICE,PRICE_EXTRA,ADVERT_DESCRIPTION_1,ADVERT_DESCRIPTION_2,WHEEL_BASE_TYPE,CAB_TYPE,FOUR_WHEEL_DRIVE,FRANCHISE_APPROVED,STYLE,SUB_STYLE,HOURS,NUMBER_OF_BERTHS,AXLE,DEALER_REFERENCE,IMAGES,VIDEO_URL,DATE_OF_REGISTRATION,SERVICE_HISTORY
"27856","2c92999f65d873af0165d8e6e1e54969","14-Sep-2018","CARS","SP62UPD","62","Audi","A3","1.6 TDI Sport 3dr","TWO OWNERS AND AUDI HISTORY","1598","CC","Diesel","2012","89260","M","Hatchback","Silver","Manual","3","2","6599","","Silver, A fantastic example of this AUDI SPORT TDI with an AUDI service history to compliment consisting of five AUDI stamps**FANTASTIC MPG**CHEAP TAX £20 per YEAR**METALLIC PAINT**TWO KEYS**BE QUICK AND DO NOT MISS OUT ON THIS SUPERB EXAMPLE!!!!!**, Upgrades - Metallic Paint, 2 owners, Service history, Standard Features - 17in x 6.5J 5 - Spoke Star Design Alloy Wheels with 225/45 R17 Tyres and Locking Wheel Bolts, Concert Single Front - Loading CD Player with MP3 File Compatibility, AUX - IN Socket, Driver Information System DIS, Dual - Zone Electronic Climate Control, Electric Front Windows, Heat - Insulating Glass, Thatcham Category 1 Alarm. 5 seats, ALL VEHICLES HPI CHECKED AND NO DEPOSIT LOW RATE FINANCE AVAILABLE. BUY WITH CONFIDENCE, £6,599","","","","","","","","","","","","http://pictures2.autotrader.co.uk/imgser-uk/servlet/media?id=6171bf18596441b780abaeee31d2380a,http://pictures2.autotrader.co.uk/imgser-uk/servlet/media?id=28f4b624383543e6b539e170ab82df52,http://pictures2.autotrader.co.uk/imgser-uk/servlet/media?id=8f61281cf2244361b0b3a0bf19cc1165,http://pictures2.autotrader.co.uk/imgser-uk/servlet/media?id=4d38555e557142ac85a1b8e324c44e96,http://pictures2.autotrader.co.uk/imgser-uk/servlet/media?id=730e1d8aff5f4615a7bb2a0bd236cfe7,http://pictures2.autotrader.co.uk/imgser-uk/servlet/media?id=a587d517dfaa463f87699047c18f1bb5,http://pictures2.autotrader.co.uk/imgser-uk/servlet/media?id=5dfdd4c697e04441b39001f8c8d3e075,http://pictures2.autotrader.co.uk/imgser-uk/servlet/media?id=3677801c109e4ea5af98f6be4d760d89,http://pictures2.autotrader.co.uk/imgser-uk/servlet/media?id=794e830668514c3c81088c9f5f459e6e,http://pictures2.autotrader.co.uk/imgser-uk/servlet/media?id=8432df705afd46ff9391ffef8b37d000,http://pictures2.autotrader.co.uk/imgser-uk/servlet/media?id=9cb71283722b4224b97e4b7398cce799,http://pictures2.autotrader.co.uk/imgser-uk/servlet/media?id=3f0233a621c74879aeaaa5f68a49b9d9,http://pictures2.autotrader.co.uk/imgser-uk/servlet/media?id=a3317c465e454a07967a443ee99bcc86,http://pictures2.autotrader.co.uk/imgser-uk/servlet/media?id=b33390fe2eeb4b88885d3e9abb550e2d,http://pictures2.autotrader.co.uk/imgser-uk/servlet/media?id=5038a0442f0044a6b26b5cb0f2786c00,http://pictures2.autotrader.co.uk/imgser-uk/servlet/media?id=3c85ed0b9ae34a978ea0695096979c9e,http://pictures2.autotrader.co.uk/imgser-uk/servlet/media?id=d7a96da4c4044b9a83713725adb1710e,http://pictures2.autotrader.co.uk/imgser-uk/servlet/media?id=4ad4a187744a47e89d2be78bcae6cfc2,http://pictures2.autotrader.co.uk/imgser-uk/servlet/media?id=a978f5ce52b74e5eba97ee64ae5ca99e,http://pictures2.autotrader.co.uk/imgser-uk/servlet/media?id=c49d0093df5f4abeb2b4f7ca1d3365ce","","09-09-2012","Service history"
"27856","2c9299cf6417964a01641875f36830aa","19-Jun-2018","CARS","ND11OCH","11","Volkswagen","Golf","1.6 TDI BlueMotion Tech SE DSG 5dr","**ONE OWNER**£30 TAX**","1598","CC","Diesel","2011","53870","M","Estate","Blue","Automatic","5","1","5999","","Blue, ** VOLKSWAGEN SERVICE HISTORY ** SUPERB EXAMPLE OF THIS RARE VEHICLE **, Upgrades - Metallic Paint, 1 owner, Full service history, Standard Features - Air Conditioning, Climatic Semi - Automatic Control, Alarm, Alarm with Interior Protection, Alloy Wheels, Four 6.5J x 16 Toronto with 205/55 R16 Low Rolling Resistance Tyres and Anti-Theft Wheel Bolts, Cruise Control, Drivers and Front Passengers Whiplash-Optimised Head Restraints, Electric Windows, Front and Rear, Heat Insulating Tinted Glass, Hill Hold Function, Multifunction Computer (Highline), RCD 310 Radio System, RCD 310 Radio/MP3 Compatible CD Player AUX-in Socket for Connection to an External Multimedia Source. MDI (Multi Device Interface) with USB and iPod Connection Cables, Rain Sensor. 5 seats, ALL VEHICLES HPI CHECKED AND NO DEPOSIT LOW RATE FINANCE AVAILABLE. BUY WITH CONFIDENCE, £5,999","","","","","","","","","","","","http://pictures2.autotrader.co.uk/imgser-uk/servlet/media?id=2bfd9cdf88724030906f1e8958fe6faf,http://pictures2.autotrader.co.uk/imgser-uk/servlet/media?id=fef76a66651442bca4c0274b71bbec37,http://pictures2.autotrader.co.uk/imgser-uk/servlet/media?id=a24200ece1314a8d87cf9fc3f3cc83df,http://pictures2.autotrader.co.uk/imgser-uk/servlet/media?id=6d300a76f0dc4e0ca8f5bf44e04bc669,http://pictures2.autotrader.co.uk/imgser-uk/servlet/media?id=ce3fdf029f6d4032be85f520489e1a0d,http://pictures2.autotrader.co.uk/imgser-uk/servlet/media?id=bd8aa7530559452b87e2c44e2f9d4df7,http://pictures2.autotrader.co.uk/imgser-uk/servlet/media?id=9a6414e49d914f5a81a922bd20673818,http://pictures2.autotrader.co.uk/imgser-uk/servlet/media?id=4fe85bb01f6046469c1e941e51c220ac,http://pictures2.autotrader.co.uk/imgser-uk/servlet/media?id=9e87a3d85ee34d888ba1e80b28bbb0a7,http://pictures2.autotrader.co.uk/imgser-uk/servlet/media?id=dea81d4cdbf04842be432d364325c427,http://pictures2.autotrader.co.uk/imgser-uk/servlet/media?id=7ac66034d29b4e9da3ceec039250e7b2,http://pictures2.autotrader.co.uk/imgser-uk/servlet/media?id=03c2d364b3584dc89649405ff6e50b58,http://pictures2.autotrader.co.uk/imgser-uk/servlet/media?id=f8d8755e71a74e239998eb83d146790b,http://pictures2.autotrader.co.uk/imgser-uk/servlet/media?id=3cad8b0660d2444bbb5d5ae470660c64,http://pictures2.autotrader.co.uk/imgser-uk/servlet/media?id=fd526d4831694cd1b360babdb9e05268,http://pictures2.autotrader.co.uk/imgser-uk/servlet/media?id=cfbd6cda7c6e47e3a81ee76f0dde01e5,http://pictures2.autotrader.co.uk/imgser-uk/servlet/media?id=5d80ecd73e6149cdbe529dce678e34bc,http://pictures2.autotrader.co.uk/imgser-uk/servlet/media?id=52a6ff5dc1d4484384a4bbf1e2f1d8f3,http://pictures2.autotrader.co.uk/imgser-uk/servlet/media?id=284ea487a9414eea80c24d1253267e1d,http://pictures2.autotrader.co.uk/imgser-uk/servlet/media?id=4e174b9af78a4db0b5961d837c66f8c5","","07-06-2011","Full service history"
"27856","2c9299d165671cda01656c42c89a57e8","24-Aug-2018","CARS","NJ63EWF","63","Nissan","Qashqai","1.5 dCi 360 5dr","SAT NAV * CRUISE * PARK CAMERA","1461","CC","Diesel","2013","46761","M","SUV","Black","Manual","5","1","9199","","Black, ***** 18 '' ALLOY WHEELS ***** BLUETOOTH TECHNOLOGY **** SURROUND CAMERA AID *****  1 OWNER FORM NEW ***** STUNNING VEHICLE ***** COMPREHENSIVE PARTS AND LABOUR WARRANTY *****, Upgrades - Metallic Paint, 1 owner, Service history, Standard Features - 18in (Onyx) Alloy Wheels, Bluetooth Integration, Cruise Control with Speed Limiter, Dual Zone Climate Control, Front and Rear Power Windows, Nissan Connect, Panoramic Glass Roof, Partial Leather Seat Trim, Radio/CD Player with USB Input, Around, Rain-Sensing Wipers, Rear Privacy Glass, Ultrasonic Alarm System, Ultrasonic Rear Park System, Rear, Front and Passenger Side View Cameras, Nissan Around View Monitor, Air conditioning, Airbags, Alarm, ESP, Folding rear seats, Electric windows, Satellite navigation, Traction Control, Third Brake Light, Traction control. 5 seats, ALL VEHICLES HPI CHECKED AND NO DEPOSIT LOW RATE FINANCE AVAILABLE. BUY WITH CONFIDENCE, £9,199","","","","","","","","","","","","http://pictures2.autotrader.co.uk/imgser-uk/servlet/media?id=e99248c22da14738a969f0a46ccdd346,http://pictures2.autotrader.co.uk/imgser-uk/servlet/media?id=c46263968f584aaeb38421c7af60fde5,http://pictures2.autotrader.co.uk/imgser-uk/servlet/media?id=1447d90bef0a4923a44662d4a99c0730,http://pictures2.autotrader.co.uk/imgser-uk/servlet/media?id=49ea87ab21cc443daa24b0716efd8153,http://pictures2.autotrader.co.uk/imgser-uk/servlet/media?id=0d0e72f8932d43488a22ff48a10d3cc6,http://pictures2.autotrader.co.uk/imgser-uk/servlet/media?id=e4c2e3a7d4684c5fa1c641d92f74f572,http://pictures2.autotrader.co.uk/imgser-uk/servlet/media?id=8318225007a34c078c25825a63ef832b,http://pictures2.autotrader.co.uk/imgser-uk/servlet/media?id=4effbc67ad1049a0a0c652221d9f86a4,http://pictures2.autotrader.co.uk/imgser-uk/servlet/media?id=f9e7beb07d7743b1a3ea0bcb6e77864c,http://pictures2.autotrader.co.uk/imgser-uk/servlet/media?id=671a183c0d744467b356d0eae8e3ef1d,http://pictures2.autotrader.co.uk/imgser-uk/servlet/media?id=dea81d4cdbf04842be432d364325c427,http://pictures2.autotrader.co.uk/imgser-uk/servlet/media?id=22601aafc7224d9f93e5a8667920f256,http://pictures2.autotrader.co.uk/imgser-uk/servlet/media?id=5043617c2731414ebc0785c1f176c60e,http://pictures2.autotrader.co.uk/imgser-uk/servlet/media?id=393f1320a70d400383d19ee9387576a5,http://pictures2.autotrader.co.uk/imgser-uk/servlet/media?id=5d80ecd73e6149cdbe529dce678e34bc,http://pictures2.autotrader.co.uk/imgser-uk/servlet/media?id=648d4295166b4211b8384115f6cfc798,http://pictures2.autotrader.co.uk/imgser-uk/servlet/media?id=5651b91bd4c4429eadc3b0c04637c787,http://pictures2.autotrader.co.uk/imgser-uk/servlet/media?id=297a131c1f184d319756f16ef72b1e8d,http://pictures2.autotrader.co.uk/imgser-uk/servlet/media?id=f2124e5d138b45f199c9c7b1a850d6cc,http://pictures2.autotrader.co.uk/imgser-uk/servlet/media?id=8926d2c5de084f0793fab8428e7cd9ef","","09-09-2013","Service history"
"27856","2c92999e652330940165338a90b96ef1","13-Aug-2018","CARS","NA56HTP","56","Audi","A3","2.0 TDI Sport Quattro 3dr","** FULL LEATHER AND CLIMATE **","1968","CC","Diesel","2006","88083","M","Hatchback","Silver","Manual","3","3","3999","","Silver, ***** STUNNING VEHICLE ***** 12 MONTHS MOT ***** COMPUTER ***** COMPREHENSIVE PARTS AND LABOUR WARRANTY ***** SUPERB SERVICE HISTORY **** SERVICED 2000 MILES AGO *****, Upgrades - Alcantara/Leather Upholstery, Paint Metallic - Optional Colours, Front Centre Armrest, 3 owners, Service history, Standard Features - Alarm, Climate Control, Computer (Driver Information System), Electric Windows (Front), Upholstery Cloth/Leather, 3x3 point rear seat belts, Air Bag Driver, Air Bag Passenger, Air conditioning, Airbags, Alloy wheels, Anti-Lock Brakes, Child locks & Isofix system, Electric door mirrors, Electric windows, Electronic Stability Programme, Folding rear seats, Front Fog Lights, Head Restraints, Height adjustable drivers seat. 5 seats, ALL VEHICLES HPI CHECKED AND NO DEPOSIT LOW RATE FINANCE AVAILABLE. BUY WITH CONFIDENCE, £3,999","","","","","","","","","","","","http://pictures2.autotrader.co.uk/imgser-uk/servlet/media?id=21018fc6518648b59ba95a2b7fec93af,http://pictures2.autotrader.co.uk/imgser-uk/servlet/media?id=2b0a3772781b402d8715225eeba68916,http://pictures2.autotrader.co.uk/imgser-uk/servlet/media?id=8926d2c5de084f0793fab8428e7cd9ef,http://pictures2.autotrader.co.uk/imgser-uk/servlet/media?id=a8793a7fa9474200afe4a6ea85b67873,http://pictures2.autotrader.co.uk/imgser-uk/servlet/media?id=c15ad72936994e9f8411dd618f41d0a9,http://pictures2.autotrader.co.uk/imgser-uk/servlet/media?id=cf3bd811d34c4f7383ee046c97f6b75f,http://pictures2.autotrader.co.uk/imgser-uk/servlet/media?id=fee28ceb14794b2aa5e1fbd8f1ac4389,http://pictures2.autotrader.co.uk/imgser-uk/servlet/media?id=75b8db5568a44098885c770ae78caf35,http://pictures2.autotrader.co.uk/imgser-uk/servlet/media?id=937bf0a1cbed409f856ec2cca649cdf4,http://pictures2.autotrader.co.uk/imgser-uk/servlet/media?id=256b231ae52b4fd090f970bc6b9353a5,http://pictures2.autotrader.co.uk/imgser-uk/servlet/media?id=ebb9810a871d4d85a8d560e07dd2d4d7,http://pictures2.autotrader.co.uk/imgser-uk/servlet/media?id=8e2fe75a9ff6492e91395aa8706ff18e,http://pictures2.autotrader.co.uk/imgser-uk/servlet/media?id=dfe607a178ba45f0a56a9314c5a490f8,http://pictures2.autotrader.co.uk/imgser-uk/servlet/media?id=22d6d4e5da1347ce8ce08426d3762d01,http://pictures2.autotrader.co.uk/imgser-uk/servlet/media?id=657ea99aba884ec4b57696f08ea31569,http://pictures2.autotrader.co.uk/imgser-uk/servlet/media?id=33c49b762dff4420b31e5b714f32107f,http://pictures2.autotrader.co.uk/imgser-uk/servlet/media?id=4947ff98d4944d8abd493142e9a4a926,http://pictures2.autotrader.co.uk/imgser-uk/servlet/media?id=ad0d91677046476a8706733680bada8b,http://pictures2.autotrader.co.uk/imgser-uk/servlet/media?id=644fadfddc2849eabf84bc93f6f8e1aa,http://pictures2.autotrader.co.uk/imgser-uk/servlet/media?id=417e48918a094db0a2074b0af1e51d75","","21-09-2006","Service history"
"27856","2c92999f6484c2cf01648f1d814617ed","12-Jul-2018","CARS","NC58SXM","58","Mazda","MX-5","1.8 Roadster 2dr","ONE OWNER AND MAZDA HISTORY","1798","CC","Petrol","2009","22585","M","Coupe","Grey","Manual","2","1","7299","","Grey, A REAL ONE OFF!!!!!!!!!!!!!! WE ARE PLEASED TO OFFER THIS ONE OWNER MAZDA WITH FULL MAZDA SERVICE HISTORY ** LOW MILEAGE ** LEATHER ** TWO KEYS ** METALLIC PAINT ** DO NOT MISS OUT !!!!!!!!!!! **, Upgrades - Metallic Paint, Heated Leather Seats, 1 owner, Full service history, Standard Features - Alarm, Alloy Wheels (16in), Climate Control, Electric Windows (Front), In Car Entertainment (Radio/CD), Climate Control Air Conditioning. 2 seats, ALL VEHICLES HPI CHECKED AND NO DEPOSIT LOW RATE FINANCE AVAILABLE. BUY WITH CONFIDENCE, £7,299","","","","","","","","","","","","http://pictures2.autotrader.co.uk/imgser-uk/servlet/media?id=f1b9f23f8d8040d183a2d7eb2db73ff7,http://pictures2.autotrader.co.uk/imgser-uk/servlet/media?id=a5628219e4a7473c9c230a3e694d61f2,http://pictures2.autotrader.co.uk/imgser-uk/servlet/media?id=1447d90bef0a4923a44662d4a99c0730,http://pictures2.autotrader.co.uk/imgser-uk/servlet/media?id=f349413ef39a4809b99464f4dfe09b54,http://pictures2.autotrader.co.uk/imgser-uk/servlet/media?id=853e02041d124069bd1340b9c5265150,http://pictures2.autotrader.co.uk/imgser-uk/servlet/media?id=9385f0d523e3478186fa5237364314ba,http://pictures2.autotrader.co.uk/imgser-uk/servlet/media?id=7cc19cc9b146406bba27ec316dc0e112,http://pictures2.autotrader.co.uk/imgser-uk/servlet/media?id=e4c2e3a7d4684c5fa1c641d92f74f572,http://pictures2.autotrader.co.uk/imgser-uk/servlet/media?id=ae4442355d9b4e938e01f152ac383a20,http://pictures2.autotrader.co.uk/imgser-uk/servlet/media?id=e3dac2018dcb4f6c89a64c298cc6e842,http://pictures2.autotrader.co.uk/imgser-uk/servlet/media?id=e1370e3a41ea4c57ad9ed7c9f2973068,http://pictures2.autotrader.co.uk/imgser-uk/servlet/media?id=66c15ae7a3924e3cb114e28b5bb1841a,http://pictures2.autotrader.co.uk/imgser-uk/servlet/media?id=6c66be6aae7f4877855d5c1c5e9891d0,http://pictures2.autotrader.co.uk/imgser-uk/servlet/media?id=de8e9ef88d04420c8d9e14c5ac9281da,http://pictures2.autotrader.co.uk/imgser-uk/servlet/media?id=c65bea9ff0cb46cf9e7822788b149055,http://pictures2.autotrader.co.uk/imgser-uk/servlet/media?id=44a25fa7c0d24d59a272525af5948206,http://pictures2.autotrader.co.uk/imgser-uk/servlet/media?id=03c2d364b3584dc89649405ff6e50b58,http://pictures2.autotrader.co.uk/imgser-uk/servlet/media?id=a24200ece1314a8d87cf9fc3f3cc83df,http://pictures2.autotrader.co.uk/imgser-uk/servlet/media?id=eb8b6d22a4e64422bc6bb94daa4aff2b,http://pictures2.autotrader.co.uk/imgser-uk/servlet/media?id=4a2d4c816f9345ee843fc50de4b7c6a9","","23-02-2009","Full service history"
"27856","2c9299d165f7334f0165fb6ec6cb6d44","21-Sep-2018","CARS","SB11FJX","11","Vauxhall","Zafira","1.8 i VVT 16v SRi Exterior Pack 5dr","COMPREHENSIVE SERVICE HISTORY","1796","CC","Petrol","2011","60370","M","MPV","","Manual","5","","4999","","Upgrades - Two-Coat Metallic Paint, Service history, Standard Features - Air Conditioning, Alloy Wheels - 18in with  225/40 R Tyres, CD 30 - CD Player/Stereo Radio, Dark-Tinted Glass (Excludes Windscreen and Front Door Windows) and GreenTinted Glass, Electrically Operated Front and Rear Windows with Safety Autoreverse and One-Touch Facility, Remote Control Ultrasonic Security Alarm. 7 seats, ALL VEHICLES HPI CHECKED AND NO DEPOSIT LOW RATE FINANCE AVAILABLE. BUY WITH CONFIDENCE, £4,999","","","","","","","","","","","","http://pictures2.autotrader.co.uk/imgser-uk/servlet/media?id=dea81d4cdbf04842be432d364325c427,http://pictures2.autotrader.co.uk/imgser-uk/servlet/media?id=5d80ecd73e6149cdbe529dce678e34bc,http://pictures2.autotrader.co.uk/imgser-uk/servlet/media?id=4e174b9af78a4db0b5961d837c66f8c5,http://pictures2.autotrader.co.uk/imgser-uk/servlet/media?id=02f7d0d538ec4800a2cb86b3ed098896,http://pictures2.autotrader.co.uk/imgser-uk/servlet/media?id=4207498bef194e18866ce4a61bc56cc9,http://pictures2.autotrader.co.uk/imgser-uk/servlet/media?id=8926d2c5de084f0793fab8428e7cd9ef","","29-06-2011","Service history"
"27856","2c9299d264ffcc0801650f6c0fec7551","06-Aug-2018","CARS","ND62SFV","62","Fiat","Punto","1.4 8v GBT (Brio Pack) 5dr","FANTASTIC SERVICE HISTORY","1368","CC","Petrol","2013","32500","M","Hatchback","Red","Manual","5","","4699","","Red, Superb example of this LOW MILEAGE rare vehicle with a service history to compliment consisting of FIVE service** Be quick and do not miss out ** TWO KEYS ** 12 MONTHS MOT ** GREAT FIRST CAR ** LOW INSURANCE ** FANTASTIC MPG **, Service history, 15in Sportline Alloy Wheels, Air Conditioning, Alloy Wheels - 15in Sportline, Dark Tinted Privacy Glass, Electric Front Windows, Radio with CD and MP3 Player. 5 seats, ALL VEHICLES HPI CHECKED AND NO DEPOSIT LOW RATE FINANCE AVAILABLE. BUY WITH CONFIDENCE, £4,699","","","","","","","","","","","","http://pictures2.autotrader.co.uk/imgser-uk/servlet/media?id=43062f2202544937b8b0e2190336bc77,http://pictures2.autotrader.co.uk/imgser-uk/servlet/media?id=403ecf19d1dc4b22bbd7d199bee6ff08,http://pictures2.autotrader.co.uk/imgser-uk/servlet/media?id=089d8e646f1548689ce4c500de999053,http://pictures2.autotrader.co.uk/imgser-uk/servlet/media?id=a639a324207f4607a2cb7ae1b56b16dd,http://pictures2.autotrader.co.uk/imgser-uk/servlet/media?id=9ac525b49b3444349b36c18ab8d5ab89,http://pictures2.autotrader.co.uk/imgser-uk/servlet/media?id=f82b41bdae7c45368011bb2c0d51795f,http://pictures2.autotrader.co.uk/imgser-uk/servlet/media?id=2e166c6b4ec143f1bae5ac1c242c2a32,http://pictures2.autotrader.co.uk/imgser-uk/servlet/media?id=4e145e7e420f4703b620267c2b922449,http://pictures2.autotrader.co.uk/imgser-uk/servlet/media?id=6cbf92871b124c6a8e7800ac6734c710,http://pictures2.autotrader.co.uk/imgser-uk/servlet/media?id=795b6a06394349ee821f6c9faf0ac808,http://pictures2.autotrader.co.uk/imgser-uk/servlet/media?id=1447d90bef0a4923a44662d4a99c0730,http://pictures2.autotrader.co.uk/imgser-uk/servlet/media?id=7d5264e86200469f9f48b1b1a8fffc20,http://pictures2.autotrader.co.uk/imgser-uk/servlet/media?id=19e589636efd4ea682f124dd9163df5e,http://pictures2.autotrader.co.uk/imgser-uk/servlet/media?id=e4c2e3a7d4684c5fa1c641d92f74f572,http://pictures2.autotrader.co.uk/imgser-uk/servlet/media?id=596e4679bb524f08b3ed7d64a2c1e21b,http://pictures2.autotrader.co.uk/imgser-uk/servlet/media?id=b5622927394847e290012122930ce9e8,http://pictures2.autotrader.co.uk/imgser-uk/servlet/media?id=ec34b93849854ec7bd635687801ab7fc,http://pictures2.autotrader.co.uk/imgser-uk/servlet/media?id=6c66be6aae7f4877855d5c1c5e9891d0,http://pictures2.autotrader.co.uk/imgser-uk/servlet/media?id=39b070e0e8884945a949bb8872d0b1cd,http://pictures2.autotrader.co.uk/imgser-uk/servlet/media?id=09c5477a07ea4630bd6d76206806fab6","","28-02-2013","Service history"
"27856","2c92999e65af7d8b0165c33c3bbc58c3","10-Sep-2018","CARS","SG59BTU","59","Volkswagen","Golf","1.4 TSI SE 3dr","** ALLOYS * AIR CON **","1390","CC","Petrol","2009","77745","M","Hatchback","Silver","Manual","3","2","4995","","Silver, ***** 2 OWNERS FROM NEW ***** 12 MONTHS MOT ***** COMPREHENSIVE PARTS AND LABOUR WARRANTY INCLUDED ***** 2 KEYS *****, 2 owners, Service history, Air Conditioning, Climatic Semi - Automatic Control, Alarm with Interior Protection, Alloy Wheels, Four 6.5J x 16 Cleveland with 205/55 R16 Tyres and Anti-Theft Wheel Bolts, Cruise Control, Drivers and Front Passengers Whiplash-Optimised Head Restraints, Electric Windows, Front, Heat Insulating Green Tinted Glass, Multifunction Computer (Midline), RCD 310 Radio/MP3 Compatible CD Player AUX-in Socket for Connection to an External Multimedia Source. MDI (Multi Device Interface) with USB and iPod Connection Cables, Rain Sensor. 5 seats, ALL VEHICLES HPI CHECKED AND NO DEPOSIT LOW RATE FINANCE AVAILABLE. BUY WITH CONFIDENCE, £4,995","","","","","","","","","","","","http://pictures2.autotrader.co.uk/imgser-uk/servlet/media?id=1792df2d73014b5284b2081f840a78f1,http://pictures2.autotrader.co.uk/imgser-uk/servlet/media?id=3fdcba99fcab4b3ba6126163f97ce787,http://pictures2.autotrader.co.uk/imgser-uk/servlet/media?id=937bf0a1cbed409f856ec2cca649cdf4,http://pictures2.autotrader.co.uk/imgser-uk/servlet/media?id=6c64df7da99245d29c9ecf0830ee84c9,http://pictures2.autotrader.co.uk/imgser-uk/servlet/media?id=c1a793ae44f04fef8ba36f31241c7961,http://pictures2.autotrader.co.uk/imgser-uk/servlet/media?id=5156f22a743b468499a0df2a5e2bba82,http://pictures2.autotrader.co.uk/imgser-uk/servlet/media?id=b23e1e89fb8f4f01bfe12288371ea7b1,http://pictures2.autotrader.co.uk/imgser-uk/servlet/media?id=4947ff98d4944d8abd493142e9a4a926,http://pictures2.autotrader.co.uk/imgser-uk/servlet/media?id=0c590208abd844b3ab361a4dedc0a029,http://pictures2.autotrader.co.uk/imgser-uk/servlet/media?id=d2954e2fb22944e6a400d48df30984cc,http://pictures2.autotrader.co.uk/imgser-uk/servlet/media?id=6f5007d2138d42af944d2417775cbdf2,http://pictures2.autotrader.co.uk/imgser-uk/servlet/media?id=d370bc04eefa4171a326f4440b3cbcf9,http://pictures2.autotrader.co.uk/imgser-uk/servlet/media?id=644fadfddc2849eabf84bc93f6f8e1aa,http://pictures2.autotrader.co.uk/imgser-uk/servlet/media?id=36a119be76a04944a980983f8e545827,http://pictures2.autotrader.co.uk/imgser-uk/servlet/media?id=1796cafc7d674aaaa4d34ce889f326cd,http://pictures2.autotrader.co.uk/imgser-uk/servlet/media?id=c311b8cfe58c405d9db37d784536ca5e,http://pictures2.autotrader.co.uk/imgser-uk/servlet/media?id=0d6f9b69b6d04dde924357b9cc4ae16f,http://pictures2.autotrader.co.uk/imgser-uk/servlet/media?id=8f61281cf2244361b0b3a0bf19cc1165,http://pictures2.autotrader.co.uk/imgser-uk/servlet/media?id=71cced08c2e045ecbec01235f4fe5976,http://pictures2.autotrader.co.uk/imgser-uk/servlet/media?id=3f0233a621c74879aeaaa5f68a49b9d9","","21-10-2009","Service history"
"27856","2c9299d265671e0a0165803805d164e0","28-Aug-2018","CARS","MF58GKZ","58","Renault","Clio","1.2 16v Dynamique 3dr","**12 MONTHS MOT**HISTORY**","1149","CC","Petrol","2008","95000","M","Hatchback","Silver","Manual","3","","1799","","Silver, Service history, 4x15W RDS Radio CD with Fingertip Control, Air Conditioning, Alloy Wheels - 15in Mahonia, Alloy Wheels - 16in Canasta, Alloy Wheels - 16in Canasta with Sports Front Wings, Automatic Windscreen Wipers, Electric Front Windows, Manual Air Conditioning, Tinted Windows. 5 seats, ALL VEHICLES HPI CHECKED AND NO DEPOSIT LOW RATE FINANCE AVAILABLE. BUY WITH CONFIDENCE, £1,799","","","","","","","","","","","","http://pictures2.autotrader.co.uk/imgser-uk/servlet/media?id=46641e7d741c441e8b1f5d4140f9cdc0,http://pictures2.autotrader.co.uk/imgser-uk/servlet/media?id=850da666c1744e4cbfb6c3ce47c50bf1,http://pictures2.autotrader.co.uk/imgser-uk/servlet/media?id=185c7d1c707a4b79ad78edba35154237,http://pictures2.autotrader.co.uk/imgser-uk/servlet/media?id=b46f8415fddc486f87851476f2284cdc,http://pictures2.autotrader.co.uk/imgser-uk/servlet/media?id=c7b87a6ae81649299971b8dcb7c31d3e,http://pictures2.autotrader.co.uk/imgser-uk/servlet/media?id=dbbe403488a04071936dc71833c7dac4,http://pictures2.autotrader.co.uk/imgser-uk/servlet/media?id=5ea2f094e9fa430aabad710c7d8b0a48,http://pictures2.autotrader.co.uk/imgser-uk/servlet/media?id=9569039a99cd4c198e4f537b63189101,http://pictures2.autotrader.co.uk/imgser-uk/servlet/media?id=b2d355c910164130969109603d63175c,http://pictures2.autotrader.co.uk/imgser-uk/servlet/media?id=eb073894bc3f4e9898f320ebe8564736,http://pictures2.autotrader.co.uk/imgser-uk/servlet/media?id=e82d370e7ccc40c28268dd179797de98,http://pictures2.autotrader.co.uk/imgser-uk/servlet/media?id=7f9b3df0edda42669a198e5419b5b7e2,http://pictures2.autotrader.co.uk/imgser-uk/servlet/media?id=67ec2694ee1e4470bec93b01c6dc6144,http://pictures2.autotrader.co.uk/imgser-uk/servlet/media?id=05dbb046e43c4d31affc3d123ab20841,http://pictures2.autotrader.co.uk/imgser-uk/servlet/media?id=3fc589edddb54342b49e62279fd9daea,http://pictures2.autotrader.co.uk/imgser-uk/servlet/media?id=7bcada2d2a324f09bf3b733ae13b1c63,http://pictures2.autotrader.co.uk/imgser-uk/servlet/media?id=abe9383afe0f485ebdf17d05a522368e,http://pictures2.autotrader.co.uk/imgser-uk/servlet/media?id=aa85769aa93e4c0d9657fa67198a6c39,http://pictures2.autotrader.co.uk/imgser-uk/servlet/media?id=b026ad0dbe594a7fb11752a78c71e2dd,http://pictures2.autotrader.co.uk/imgser-uk/servlet/media?id=c7388159abbd4aa0859bfd2b697bb04d","","27-09-2008","Service history"
