DID,STOCK_ITEM_ID,CREATED_DATE,CATEGORY,REGISTRATION,REG_CODE,MAKE,MODEL,DERIVATIVE,ATTENTION_GRABBER,ENGINE_SIZE,ENGINE_SIZE_UNIT,FUEL_TYPE,MANUFACTURED_YEAR,MILEAGE,MILEAGE_UNIT,BODYTYPE,COLOUR,TRANSMISSION,DOORS,PREVIOUS_OWNERS,PRICE,PRICE_EXTRA,ADVERT_DESCRIPTION_1,ADVERT_DESCRIPTION_2,WHEEL_BASE_TYPE,CAB_TYPE,FOUR_WHEEL_DRIVE,FRANCHISE_APPROVED,STYLE,SUB_STYLE,HOURS,NUMBER_OF_BERTHS,AXLE,DEALER_REFERENCE,IMAGES,VIDEO_URL,DATE_OF_REGISTRATION,SERVICE_HISTORY
"27856","2c9299d0663f44410166445c27cd78e8","05-Oct-2018","CARS","EX10VBE","10","Audi","A3","1.8 TFSI S line 3dr","","1798","CC","Petrol","2010","67740","M","Hatchback","White","Manual","3","3","7499","","White, 3 owners, Service history, 18in x 7.5J 7 Twin - Spoke Design Alloy Wheels with 225/40 R18 Tyres and Locking Wheel Bolts, Concert Single Front - Loading CD Player with MP3 File Compatibility, AUX - IN Socket, Driver Information System DIS, Dual - Zone Electronic Climate Control, Electric Front Windows, Heat - Insulating Glass, Thatcham Category 1 Alarm, Upholstery - Black Sprint Cloth/Leather Upholstery with Embossed S Line Logo. 5 seats, ALL VEHICLES HPI CHECKED AND NO DEPOSIT LOW RATE FINANCE AVAILABLE. BUY WITH CONFIDENCE, £7,499","","","","","","","","","","","","http://pictures2.autotrader.co.uk/imgser-uk/servlet/media?id=9569039a99cd4c198e4f537b63189101,http://pictures2.autotrader.co.uk/imgser-uk/servlet/media?id=fd526d4831694cd1b360babdb9e05268,http://pictures2.autotrader.co.uk/imgser-uk/servlet/media?id=a05b3068a87c4569aec3393f04aa1974","","08-03-2010","Service history"
"27856","2c92999f62be313e0162c4ac6aac4eb6","14-Apr-2018","CARS","NC58CAV","58","Volvo","V50","1.6 D S 5dr","COMPREHENSIVE SERVICE HISTORY","1560","CC","Diesel","2008","78730","M","Estate","Grey","Manual","5","","3499","","Grey, Upgrades - Metallic Paint, Service history, Standard Features - Alarm, Alloy Wheels (16in), Climate Control, Computer (Driver Information System), Cruise Control, Electric Windows (Front/Rear), In Car Entertainment (Radio/CD), Tinted Glass, Whiplash Protection System. 5 seats, ALL VEHICLES HPI CHECKED AND NO DEPOSIT LOW RATE FINANCE AVAILABLE. BUY WITH CONFIDENCE, £3,499","","","","","","","","","","","","http://pictures2.autotrader.co.uk/imgser-uk/servlet/media?id=b84547f9a2ce4959a8f445959f71c524,http://pictures2.autotrader.co.uk/imgser-uk/servlet/media?id=3dfa607761124f6d82bd6223d1783a70,http://pictures2.autotrader.co.uk/imgser-uk/servlet/media?id=8f61281cf2244361b0b3a0bf19cc1165,http://pictures2.autotrader.co.uk/imgser-uk/servlet/media?id=4ad3d7f4c04a4a949b6ce4b0c22acd73,http://pictures2.autotrader.co.uk/imgser-uk/servlet/media?id=e470b05c5f974ea6917aa722a247b00a,http://pictures2.autotrader.co.uk/imgser-uk/servlet/media?id=3f0233a621c74879aeaaa5f68a49b9d9,http://pictures2.autotrader.co.uk/imgser-uk/servlet/media?id=29aff88d7e5e4361a805d533f9c33991,http://pictures2.autotrader.co.uk/imgser-uk/servlet/media?id=1c33006e7f8648c5ad40e3027c799a04,http://pictures2.autotrader.co.uk/imgser-uk/servlet/media?id=d7a96da4c4044b9a83713725adb1710e,http://pictures2.autotrader.co.uk/imgser-uk/servlet/media?id=c0768e87c4fa4de8839dce381f0a0807,http://pictures2.autotrader.co.uk/imgser-uk/servlet/media?id=0b0cce8a687d40679d05a3396fb347e9,http://pictures2.autotrader.co.uk/imgser-uk/servlet/media?id=62af76612f6d48469b4c6acfee5b104a,http://pictures2.autotrader.co.uk/imgser-uk/servlet/media?id=90e3dcf4b59d40eb87957ec753ee8900,http://pictures2.autotrader.co.uk/imgser-uk/servlet/media?id=291288c8fb124771ac13cff3f010fb3d,http://pictures2.autotrader.co.uk/imgser-uk/servlet/media?id=712d008ab123433caeaf16787787877d,http://pictures2.autotrader.co.uk/imgser-uk/servlet/media?id=e8b9f38eed1d45d481e9c9acf5af41e8,http://pictures2.autotrader.co.uk/imgser-uk/servlet/media?id=fa64d24dd2f042f08e32d7a5588674f0,http://pictures2.autotrader.co.uk/imgser-uk/servlet/media?id=c66faca1e3ac4174b53ea530e282f2ea,http://pictures2.autotrader.co.uk/imgser-uk/servlet/media?id=7b74bd240d6a437dae56887a83d28331,http://pictures2.autotrader.co.uk/imgser-uk/servlet/media?id=cf3b121728574cbbac2db54e0cf8d900","","17-12-2008","Service history"
"27856","2c92999e653931db01654d18926a2293","18-Aug-2018","CARS","FE59JFJ","59","Volvo","S40","1.6 TD DRIVe SE 4dr","**12 MONTHS MOT**","1560","CC","Diesel","2009","104000","M","Saloon","Silver","Manual","4","4","2799","","Silver, Upgrades - Metallic Paint, 4 owners, Standard Features - 17in Zaurak Alloy Wheels (Silver Bright)  - 205/50 R17 W Tyres with Locking Wheel Nuts, Anti-Theft Alarm and Level Sensor, Cruise Control, ECC (Electronic Climate Control) with AQS (Air Quality System) and Pollen Filter, Front and Rear Auto Open/Close Power Windows, IDIS (Intelligent Driver Information System) with Information Centre, Performance Sound Audio System - 1x Radio/CD, Aux Input for MP3 Player, Rain Sensor, Tinted Windows, WHIPS (Whiplash Protection System). 5 seats, ALL VEHICLES HPI CHECKED AND NO DEPOSIT LOW RATE FINANCE AVAILABLE. BUY WITH CONFIDENCE, £2,799","","","","","","","","","","","","http://pictures2.autotrader.co.uk/imgser-uk/servlet/media?id=76a5d43d2b0440b99055428365c72792,http://pictures2.autotrader.co.uk/imgser-uk/servlet/media?id=605a41a811bf46d784caed40d4e2c225,http://pictures2.autotrader.co.uk/imgser-uk/servlet/media?id=185c7d1c707a4b79ad78edba35154237,http://pictures2.autotrader.co.uk/imgser-uk/servlet/media?id=e3cd27e970e14a18b5de9c0614305176,http://pictures2.autotrader.co.uk/imgser-uk/servlet/media?id=3413bde35d934cc89f34447bbc4bad05,http://pictures2.autotrader.co.uk/imgser-uk/servlet/media?id=b616b161f061442da91ab719b0c2d62d,http://pictures2.autotrader.co.uk/imgser-uk/servlet/media?id=6ea59d12c8664d62b630d97da43d3f63,http://pictures2.autotrader.co.uk/imgser-uk/servlet/media?id=67ec2694ee1e4470bec93b01c6dc6144,http://pictures2.autotrader.co.uk/imgser-uk/servlet/media?id=37c5285ff38a44808a5ef807fdd49f91,http://pictures2.autotrader.co.uk/imgser-uk/servlet/media?id=81e9ba4a4aaf4f42ad192f15930229bb,http://pictures2.autotrader.co.uk/imgser-uk/servlet/media?id=0eaf54d9e98b41199a4f310b9a1b7db1,http://pictures2.autotrader.co.uk/imgser-uk/servlet/media?id=00a20c51fdb94194af9193fa18a73644,http://pictures2.autotrader.co.uk/imgser-uk/servlet/media?id=9569039a99cd4c198e4f537b63189101,http://pictures2.autotrader.co.uk/imgser-uk/servlet/media?id=b8e7ef5de092450ab482e16a78bdd7ee,http://pictures2.autotrader.co.uk/imgser-uk/servlet/media?id=9f12ec0139444c33a95a07edf34c794a,http://pictures2.autotrader.co.uk/imgser-uk/servlet/media?id=a37b5a600e5042e68de1b62bc6fa3687,http://pictures2.autotrader.co.uk/imgser-uk/servlet/media?id=fbe8039065d24cd697b0c224bb361314,http://pictures2.autotrader.co.uk/imgser-uk/servlet/media?id=ef0c1ae38ace4a4fb5dff9e8c6d149f1,http://pictures2.autotrader.co.uk/imgser-uk/servlet/media?id=d7a6031310894241802585c4c8f6c406,http://pictures2.autotrader.co.uk/imgser-uk/servlet/media?id=74f20efe699a4c0c9e2a3a9e90307603","","14-12-2009",""
"27856","2c92999f65f72fb80165fb6ce94a7d18","21-Sep-2018","CARS","AD10DJK","10","Volvo","S40","1.6 TD DRIVe SE (s/s) 4dr","COMPREHENSIVE SERVICE HISTORY","1560","CC","Diesel","2010","62300","M","Saloon","Grey","Manual","4","","4799","","Grey, A FANTASTIC EXAMPLE OF THIS VOLVO S40 WITH A SERVICE HISTORY TO COMPLIMENT CONSISTING OF SIX STAMPS**ONLY £20 YEAR ROAD TAX**FANTASTIC MPG**12 MONTHS MOT**LEATHER**BLUETOOTH**METALLIC PAINT**TWO KEYS**12 MONTHS MOT**, Upgrades - Metallic Paint, Leather Faced Upholstery Upgrade, Service history, Standard Features - 17in Zaurak Alloy Wheels (Silver Bright)  - 205/50 R17 W Tyres with Locking Wheel Nuts, Anti-Theft Alarm and Level Sensor, Cruise Control, ECC (Electronic Climate Control) with AQS (Air Quality System) and Pollen Filter, Front and Rear Auto Open/Close Power Windows, IDIS (Intelligent Driver Information System) with Information Centre, Performance Sound Audio System - 1x Radio/CD, Aux Input for MP3 Player, Rain Sensor, Start/Stop System, Tinted Windows, WHIPS (Whiplash Protection System). 5 seats, ALL VEHICLES HPI CHECKED AND NO DEPOSIT LOW RATE FINANCE AVAILABLE. BUY WITH CONFIDENCE, £4,799","","","","","","","","","","","","http://pictures2.autotrader.co.uk/imgser-uk/servlet/media?id=cbd9163b9ac748199a5408cc0cdad581,http://pictures2.autotrader.co.uk/imgser-uk/servlet/media?id=fc0223c37b7a47b5bf1d038fdb1fa6ef,http://pictures2.autotrader.co.uk/imgser-uk/servlet/media?id=960aaca77c0846f7a58c003fbecdbfdb,http://pictures2.autotrader.co.uk/imgser-uk/servlet/media?id=42793ea0035748dc88fdae2ebd9decfc,http://pictures2.autotrader.co.uk/imgser-uk/servlet/media?id=844d8d76066943b28901632b9fab6b78,http://pictures2.autotrader.co.uk/imgser-uk/servlet/media?id=748b47022a0442d4a27379975e1fdda8,http://pictures2.autotrader.co.uk/imgser-uk/servlet/media?id=c23cf6447703459aaa03bbe2b49a95f8,http://pictures2.autotrader.co.uk/imgser-uk/servlet/media?id=7acfc8cabcab4fa1867e96e136a6e260,http://pictures2.autotrader.co.uk/imgser-uk/servlet/media?id=650e96bb9e764e649c3ccf65da29fc52,http://pictures2.autotrader.co.uk/imgser-uk/servlet/media?id=1b536f8b267245e1af20e063752d7943,http://pictures2.autotrader.co.uk/imgser-uk/servlet/media?id=b8ea978b997540f291e20a01588e5228,http://pictures2.autotrader.co.uk/imgser-uk/servlet/media?id=7cf52c0bd43345bc8469186f854efdf4,http://pictures2.autotrader.co.uk/imgser-uk/servlet/media?id=e6d01d18da3240e3a1ca4724446ff5b0,http://pictures2.autotrader.co.uk/imgser-uk/servlet/media?id=eef36be5141a424a96c527e835b6b69d,http://pictures2.autotrader.co.uk/imgser-uk/servlet/media?id=b2b4c5f2133f44b5b9edbba2aaccd07a,http://pictures2.autotrader.co.uk/imgser-uk/servlet/media?id=44fd0272788f4a4c9bc818b08f97da3a,http://pictures2.autotrader.co.uk/imgser-uk/servlet/media?id=29acdb75e1e74bbbbf03567080ca511f,http://pictures2.autotrader.co.uk/imgser-uk/servlet/media?id=67b91efd2a7446529f0456c404737496,http://pictures2.autotrader.co.uk/imgser-uk/servlet/media?id=4870cfeb206444349ad393723a4b4ec0,http://pictures2.autotrader.co.uk/imgser-uk/servlet/media?id=7b74bd240d6a437dae56887a83d28331","","29-06-2010","Service history"
"27856","2c9299cf65af803b0165c315f1d0092e","10-Sep-2018","CARS","BN11AFK","11","Vauxhall","Astra","1.4 i 16v Turbo SRi 5dr","* 18'' ALLOYS ** FULL LEATHER *","1364","CC","Petrol","2011","65125","M","Hatchback","Red","Manual","5","","5499","","Red, ***** MASSIVE SPECIFICATION *****SATELLITE NAVIGATION***** 12 MONTHS MOT ***** COMPREHENSIVE PARTS AND LABOUR WARRANTY INCLUDED ***** STUNNING IN SRI RED ***** 6 SERVICE HISTORY STAMPS *****, Upgrades - Two-Coat Pearlescent Paint, Leather Pack, Alloy Wheels - 18in Five Twin-Spoke, CD 500 Satellite Navigation/Radio/CD/MP3, Service history, Standard Features - 17in Alloy Wheels with Locking Wheel Nuts, Air Conditioning with Air Recirculation, CD 400 - CD Player with MP3 Format/Stereo Radio with Auxiliary-In Socket, Cruise Control, Electrically Operated Front Windows with Safety Autoreverse and One-Touch Facility, Hill Start Assist (HSA), Remote Control Ultrasonic Security Alarm System, Tinted Glass. 5 seats, ALL VEHICLES HPI CHECKED AND NO DEPOSIT LOW RATE FINANCE AVAILABLE. BUY WITH CONFIDENCE, £5,499","","","","","","","","","","","","http://pictures2.autotrader.co.uk/imgser-uk/servlet/media?id=61718558b1d64b04aecdd99deb1ef45d,http://pictures2.autotrader.co.uk/imgser-uk/servlet/media?id=8e64f0fe40814257a06e4d27b3b0e121,http://pictures2.autotrader.co.uk/imgser-uk/servlet/media?id=089d8e646f1548689ce4c500de999053,http://pictures2.autotrader.co.uk/imgser-uk/servlet/media?id=2e9bb9b2dec342b6a20d15f459944bbf,http://pictures2.autotrader.co.uk/imgser-uk/servlet/media?id=331d52aba3344965b7949c167cca5fed,http://pictures2.autotrader.co.uk/imgser-uk/servlet/media?id=d808ac5f0e384f48986cb5f4235495a5,http://pictures2.autotrader.co.uk/imgser-uk/servlet/media?id=1447d90bef0a4923a44662d4a99c0730,http://pictures2.autotrader.co.uk/imgser-uk/servlet/media?id=a8be7113b55b4b31b5f24ebe455ee0c2,http://pictures2.autotrader.co.uk/imgser-uk/servlet/media?id=e534676035a549b593c0dc3d094ae360,http://pictures2.autotrader.co.uk/imgser-uk/servlet/media?id=0b681931411b439388d7932b03b9ad32,http://pictures2.autotrader.co.uk/imgser-uk/servlet/media?id=e4c2e3a7d4684c5fa1c641d92f74f572,http://pictures2.autotrader.co.uk/imgser-uk/servlet/media?id=6f9346d4e56944eb9f697e50e910d22a,http://pictures2.autotrader.co.uk/imgser-uk/servlet/media?id=8ced3a6c249943df934a5fef4d541062,http://pictures2.autotrader.co.uk/imgser-uk/servlet/media?id=c805efb6260b4c4db52f31adecdd502e,http://pictures2.autotrader.co.uk/imgser-uk/servlet/media?id=a24200ece1314a8d87cf9fc3f3cc83df,http://pictures2.autotrader.co.uk/imgser-uk/servlet/media?id=b4bdd2772c1140e59e30b9af4262364d,http://pictures2.autotrader.co.uk/imgser-uk/servlet/media?id=c8b69e55bd424d94ae93b8403ce0535f,http://pictures2.autotrader.co.uk/imgser-uk/servlet/media?id=6c66be6aae7f4877855d5c1c5e9891d0,http://pictures2.autotrader.co.uk/imgser-uk/servlet/media?id=b1b10059c81d4c6fb607d3ff5c5326c1,http://pictures2.autotrader.co.uk/imgser-uk/servlet/media?id=16851a2b249f4dce8820a40e6885cd6a","","15-03-2011","Service history"
"27856","2c9299d265af84560165c85fea631c1b","11-Sep-2018","CARS","YK10KNX","10","BMW","X3","2.0 20d M Sport xDrive 5dr","**LOW MILEAGE AND HISTORY**","1995","CC","Diesel","2010","54000","M","SUV","Silver","Automatic","5","","10499","","Silver, A superb example of this rare BMW AUTOMATIC with a service history to compliment consisting of five stamps**, Upgrades - Sun Protection Glazing, Upholstery - Nevada Leather, Metallic Paintwork, Service history, Standard Features - 18in Light Alloy M Double - Spoke Style 192 Wheel with 235/50 R18 Front, 255/45 R18 Rear Tyres and Locking Wheel Bolts, Air Conditioning, Automatic with Two - Zone Control, Alarm System (Thatcham 1) with Remote Control, Anti - Whiplash Front Head Restraints, BMW Business Radio with Single CD Player (with MP3 Playback Capability), Auxiliary Input Point, Comfort Access, Electric Windows - Front and Rear, with Open/Close Fingertip Control, Anti - Trap Facility and Comfort Closing Function All Round, Hill Descent Control (HDC), Hill - Start Assistant, On - Board Computer (OBC), Park Distance Control (PDC), Front and Rear, Performance Control, Rain Sensor, Tyre Puncture Warning System (TPWS), Windows - Heat - Insulated, Green Tinted All Round. 5 seats, ALL VEHICLES HPI CHECKED AND NO DEPOSIT LOW RATE FINANCE AVAILABLE. BUY WITH CONFIDENCE, £10,499","","","","","","","","","","","","http://pictures2.autotrader.co.uk/imgser-uk/servlet/media?id=55b5a1e0c15d4b3eb8a69dbc8fa8a476,http://pictures2.autotrader.co.uk/imgser-uk/servlet/media?id=e2ab18cde1804f32a89cb36b09818998,http://pictures2.autotrader.co.uk/imgser-uk/servlet/media?id=8f61281cf2244361b0b3a0bf19cc1165,http://pictures2.autotrader.co.uk/imgser-uk/servlet/media?id=7e30f413050e4f3ab899024ff6e9bd4a,http://pictures2.autotrader.co.uk/imgser-uk/servlet/media?id=64958a940b944bf0b25e30f15ba69fce,http://pictures2.autotrader.co.uk/imgser-uk/servlet/media?id=2476e8ce5d244852a40829d98296c11e,http://pictures2.autotrader.co.uk/imgser-uk/servlet/media?id=e810f4cea8a54b8cb00506b69091dde5,http://pictures2.autotrader.co.uk/imgser-uk/servlet/media?id=3f0233a621c74879aeaaa5f68a49b9d9,http://pictures2.autotrader.co.uk/imgser-uk/servlet/media?id=8d0011e85c874339a9aef21caa2e9164,http://pictures2.autotrader.co.uk/imgser-uk/servlet/media?id=53105956dd6a4038872da249b076d62e,http://pictures2.autotrader.co.uk/imgser-uk/servlet/media?id=2b11ba137eda48949bf675598b4e9a5a,http://pictures2.autotrader.co.uk/imgser-uk/servlet/media?id=274532488e664352b6dbf4ca0fbff503,http://pictures2.autotrader.co.uk/imgser-uk/servlet/media?id=5fa4df898ee346158364c740fe292225,http://pictures2.autotrader.co.uk/imgser-uk/servlet/media?id=d7a96da4c4044b9a83713725adb1710e,http://pictures2.autotrader.co.uk/imgser-uk/servlet/media?id=c3a611069b8d4fa5bb50cd7372eb3759,http://pictures2.autotrader.co.uk/imgser-uk/servlet/media?id=a27716d9dc7d4209897a48c692acc48f,http://pictures2.autotrader.co.uk/imgser-uk/servlet/media?id=6a2e06d668de4dc08fd6b71a50b66ca1,http://pictures2.autotrader.co.uk/imgser-uk/servlet/media?id=75f5ace5f001448e8072402d7b9fe006,http://pictures2.autotrader.co.uk/imgser-uk/servlet/media?id=8ede4769a77a4ae0a345b582bc0a23c3,http://pictures2.autotrader.co.uk/imgser-uk/servlet/media?id=754e15c6c82b46b5a1486f4c6625256d","","01-03-2010","Service history"
"27856","2c9299d26539393b01654d4608fc49da","18-Aug-2018","CARS","SL06OUW","06","Lexus","RX 300","3.0 SE 5dr","ONE OWNER AND HISTORY","2995","CC","Petrol","2006","91550","M","SUV","Silver","Automatic","5","1","4799","","Silver, FANTASTIC EXAMPLE OF THIS ONE OWNER CAR WITH A LEXUS SERVICE HISTORY TO COMPLIMENT**TRUE ONE OFF< DO NOT MISS OUT**, Upgrades - Metallic Paint, Lexus Navigator System, 1 owner, Service history, Standard Features - Alarm, Alloy Wheels (18in), Climate Control, Cruise Control, Electric Windows (Front/Rear), In Car Entertainment (Radio/Cassette/CD Autochanger), Seats Electric (Driver/Passenger), Seats Heated (Driver/Passenger), Sunroof Electric (Glass Tilt/Slide), Upholstery Leather. 5 seats, ALL VEHICLES HPI CHECKED AND NO DEPOSIT LOW RATE FINANCE AVAILABLE. BUY WITH CONFIDENCE, £4,799","","","","","","","","","","","","http://pictures2.autotrader.co.uk/imgser-uk/servlet/media?id=67ec2694ee1e4470bec93b01c6dc6144,http://pictures2.autotrader.co.uk/imgser-uk/servlet/media?id=185c7d1c707a4b79ad78edba35154237,http://pictures2.autotrader.co.uk/imgser-uk/servlet/media?id=9569039a99cd4c198e4f537b63189101,http://pictures2.autotrader.co.uk/imgser-uk/servlet/media?id=ef0c1ae38ace4a4fb5dff9e8c6d149f1","","31-03-2006","Service history"
"27856","2c9299d164b82e790164c6a316231226","23-Jul-2018","CARS","MW07XMX","07","Toyota","AYGO","1.0 VVT-i Black 3dr","SUPERB LOW LOW MILES","998","CC","Petrol","2007","24350","M","Hatchback","Black","Manual","3","","2799","","Black, SERVICE HISTORY *** 12 MONTHS MOT *** COMPREHENSIVE PARTS AND LABOUR WARRANTY ***, Service history, Alloy Wheels (14in), Electric Windows (Front), In Car Entertainment (Radio/CD), Metallic Paint. 4 seats, ALL VEHICLES HPI CHECKED AND NO DEPOSIT LOW RATE FINANCE AVAILABLE. BUY WITH CONFIDENCE, £2,799","","","","","","","","","","","","http://pictures2.autotrader.co.uk/imgser-uk/servlet/media?id=74aa48fa2f0d4729acaf90a9f1abf960,http://pictures2.autotrader.co.uk/imgser-uk/servlet/media?id=3e66ed8e5a994ac7822a945f1813f791,http://pictures2.autotrader.co.uk/imgser-uk/servlet/media?id=03c2d364b3584dc89649405ff6e50b58,http://pictures2.autotrader.co.uk/imgser-uk/servlet/media?id=3e88226e63684e6593048e9488283758,http://pictures2.autotrader.co.uk/imgser-uk/servlet/media?id=bec71f64ad0a4ae3b6ca87365c3cc93f,http://pictures2.autotrader.co.uk/imgser-uk/servlet/media?id=5d50565b38a440079d8d39a2b1be53a5,http://pictures2.autotrader.co.uk/imgser-uk/servlet/media?id=458626d4f7274bddbd744e4c56289b28,http://pictures2.autotrader.co.uk/imgser-uk/servlet/media?id=a05b3068a87c4569aec3393f04aa1974,http://pictures2.autotrader.co.uk/imgser-uk/servlet/media?id=ed5a602402ec489db1384a823d7cc7bc,http://pictures2.autotrader.co.uk/imgser-uk/servlet/media?id=4fe9dbff019c449b81fd816e45fba3da,http://pictures2.autotrader.co.uk/imgser-uk/servlet/media?id=9ece4bc9918848788c2999548e79f1de,http://pictures2.autotrader.co.uk/imgser-uk/servlet/media?id=017a63afeafa4c01a4123fee611fd533,http://pictures2.autotrader.co.uk/imgser-uk/servlet/media?id=cf3bd811d34c4f7383ee046c97f6b75f,http://pictures2.autotrader.co.uk/imgser-uk/servlet/media?id=36805a6c85d945d485680896e346ab3f,http://pictures2.autotrader.co.uk/imgser-uk/servlet/media?id=e7cc2ff2715e4edf8ab12ae3f3bbb323,http://pictures2.autotrader.co.uk/imgser-uk/servlet/media?id=b8032c4913844282bd737d76983d351e,http://pictures2.autotrader.co.uk/imgser-uk/servlet/media?id=dc4bba28d93d4437844ba7734ece28d7,http://pictures2.autotrader.co.uk/imgser-uk/servlet/media?id=002a2a144e4048c88996a0083de3027c,http://pictures2.autotrader.co.uk/imgser-uk/servlet/media?id=d1038b0069d744f9a1d1b61f52b8894f,http://pictures2.autotrader.co.uk/imgser-uk/servlet/media?id=90dadcbda20a4b538b0779604be65f3d","","15-08-2007","Service history"
"27856","2c92999e65af7d8b0165c85f9ca2573d","11-Sep-2018","CARS","LK13RMU","13","Vauxhall","Zafira","1.6 i VVT 16v Exclusiv 5dr","**ONE OWNER AND HISTORY**","1598","CC","Petrol","2013","72025","M","MPV","White","Manual","5","1","5175","","White, A superb example of this popular VAUXHALL SEVEN SEATER**ONE OWNER**SERVICE HISTORY**UPGRADED 17'' FIVE SPOKE ALLOY WHEELS**TWO KEYS**12 MONTHS MOT**, 1 owner, Service history, 16in Structure Wheels with Locking Wheel Bolts, Air Conditioning, CD 30 - CD Player/Stereo Radio, Electrically Operated Front Windows with Safety Autoreverse and One-Touch Facility, Green-Tinted Glass. 7 seats, ALL VEHICLES HPI CHECKED AND NO DEPOSIT LOW RATE FINANCE AVAILABLE. BUY WITH CONFIDENCE, £5,175","","","","","","","","","","","","http://pictures2.autotrader.co.uk/imgser-uk/servlet/media?id=3b62edd25f56413f95f837e184349f3a,http://pictures2.autotrader.co.uk/imgser-uk/servlet/media?id=e5853c0a39bf4596bbf789056c361fa4,http://pictures2.autotrader.co.uk/imgser-uk/servlet/media?id=8f61281cf2244361b0b3a0bf19cc1165,http://pictures2.autotrader.co.uk/imgser-uk/servlet/media?id=91862b64cc494303a8cae15eec4a0e97,http://pictures2.autotrader.co.uk/imgser-uk/servlet/media?id=a849e60cefb844fdbf937267e87a67dd,http://pictures2.autotrader.co.uk/imgser-uk/servlet/media?id=3f0233a621c74879aeaaa5f68a49b9d9,http://pictures2.autotrader.co.uk/imgser-uk/servlet/media?id=16d4d02cae4d4eb6bc03a3268fb1a892,http://pictures2.autotrader.co.uk/imgser-uk/servlet/media?id=e91f2fe7f533414d88185f1b75b56113,http://pictures2.autotrader.co.uk/imgser-uk/servlet/media?id=0d620fa2d57e4182afb7c3fbe215e312,http://pictures2.autotrader.co.uk/imgser-uk/servlet/media?id=835c49c2f9dd46d3b4acd00d7c8ddcb0,http://pictures2.autotrader.co.uk/imgser-uk/servlet/media?id=f80a3ad2356040a6bbe517a30948aa38,http://pictures2.autotrader.co.uk/imgser-uk/servlet/media?id=d7a96da4c4044b9a83713725adb1710e,http://pictures2.autotrader.co.uk/imgser-uk/servlet/media?id=f74047d6a19c4e71b72c4c93367cda94,http://pictures2.autotrader.co.uk/imgser-uk/servlet/media?id=22ec6b33392044b4a77b1000f9921bc7,http://pictures2.autotrader.co.uk/imgser-uk/servlet/media?id=6e8fe062d1e145c9b4c861e2e28bee28,http://pictures2.autotrader.co.uk/imgser-uk/servlet/media?id=530c8cdc28f84c978768928e73e42552,http://pictures2.autotrader.co.uk/imgser-uk/servlet/media?id=1485f1d4f60e4145a5ae784a9c19c333,http://pictures2.autotrader.co.uk/imgser-uk/servlet/media?id=85ee1a1b9506463fa9e0c7bdec85d242,http://pictures2.autotrader.co.uk/imgser-uk/servlet/media?id=fa64d24dd2f042f08e32d7a5588674f0,http://pictures2.autotrader.co.uk/imgser-uk/servlet/media?id=dcc52d9e491243c6b61ff155bec09565","","02-03-2013","Service history"
"27856","2c92999e64b829a60164f544b54915b3","01-Aug-2018","CARS","AD07BVG","07","Mercedes-Benz","R Class","3.0 R320 CDI Sport 7G-Tronic 5dr","VERY RARE VEHICLE","2987","CC","Diesel","2007","72000","M","MPV","Silver","Automatic","5","","6599","","Silver, *** GREAT SERVICE HISTORY *** 7 STAMPS *** 12 MONTHS MOT *** COMPREHENSIVE PARTS AND LABOUR WARRANTY *** GREAT DRIVER *** MASSIVE SPECIFICATION ***, Upgrades - COMMAND, Heated Front Seats, Tyre Pressure Monitoring System, Parktronic, Cntr Console in 2nd Seat Row with 12v Power Socket, Linguatronic Voice Activation, Telephone Pre-Wiring with Hands-Free Facility, Compass, Service history, Standard Features - Alarm, Alloy Wheels (19in), Climate Control, Computer (Driver Information System), Cruise Control, Electric Windows (Front/Rear), In Car Entertainment (Radio/CD), Paint Metallic, Rain Sensor, Seats Electric (Driver/Passenger), Tyre Pressure Control, Metallic Paint. 6 seats, ALL VEHICLES HPI CHECKED AND NO DEPOSIT LOW RATE FINANCE AVAILABLE. BUY WITH CONFIDENCE, £6,599","","","","","","","","","","","","http://pictures2.autotrader.co.uk/imgser-uk/servlet/media?id=7413ae2b14a644558b61bf704ce520c0,http://pictures2.autotrader.co.uk/imgser-uk/servlet/media?id=d1098c97c97641828fa8c91474f5790d,http://pictures2.autotrader.co.uk/imgser-uk/servlet/media?id=22d6d4e5da1347ce8ce08426d3762d01,http://pictures2.autotrader.co.uk/imgser-uk/servlet/media?id=a593f348b35e41b8846b7d58d6557b41,http://pictures2.autotrader.co.uk/imgser-uk/servlet/media?id=8e097d9e7368444caffdbadd3ebd92fc,http://pictures2.autotrader.co.uk/imgser-uk/servlet/media?id=fd116a0f46bd45e1a12d1c95ebef1222,http://pictures2.autotrader.co.uk/imgser-uk/servlet/media?id=a5e47b31ebaf4eab94ba9f80d9f40d8f,http://pictures2.autotrader.co.uk/imgser-uk/servlet/media?id=cf30e73a6e024c8a82d00bc482d65680,http://pictures2.autotrader.co.uk/imgser-uk/servlet/media?id=7aba3f6ab47243ab8852f31e106f88ad,http://pictures2.autotrader.co.uk/imgser-uk/servlet/media?id=6e574d1708d0418eb5556629668a4d6c,http://pictures2.autotrader.co.uk/imgser-uk/servlet/media?id=8078dd3a3c444e689dcb599d95840aa8,http://pictures2.autotrader.co.uk/imgser-uk/servlet/media?id=4e174b9af78a4db0b5961d837c66f8c5,http://pictures2.autotrader.co.uk/imgser-uk/servlet/media?id=02f7d0d538ec4800a2cb86b3ed098896,http://pictures2.autotrader.co.uk/imgser-uk/servlet/media?id=8956e4615586423a9896da32d5e99254,http://pictures2.autotrader.co.uk/imgser-uk/servlet/media?id=acda3ad634544a26afe8565e0580eb0a,http://pictures2.autotrader.co.uk/imgser-uk/servlet/media?id=002a2a144e4048c88996a0083de3027c,http://pictures2.autotrader.co.uk/imgser-uk/servlet/media?id=508963178dab4269932d5e49228866dd,http://pictures2.autotrader.co.uk/imgser-uk/servlet/media?id=42b700f1cd084c5c83d8f3cb5b4cce2b,http://pictures2.autotrader.co.uk/imgser-uk/servlet/media?id=3f0233a621c74879aeaaa5f68a49b9d9,http://pictures2.autotrader.co.uk/imgser-uk/servlet/media?id=c5877847ed1f473bbbce82b2f8732682","","21-05-2007","Service history"
