DID,STOCK_ITEM_ID,CREATED_DATE,CATEGORY,REGISTRATION,REG_CODE,MAKE,MODEL,DERIVATIVE,ATTENTION_GRABBER,ENGINE_SIZE,ENGINE_SIZE_UNIT,FUEL_TYPE,MANUFACTURED_YEAR,MILEAGE,MILEAGE_UNIT,BODYTYPE,COLOUR,TRANSMISSION,DOORS,PREVIOUS_OWNERS,PRICE,PRICE_EXTRA,ADVERT_DESCRIPTION_1,ADVERT_DESCRIPTION_2,WHEEL_BASE_TYPE,CAB_TYPE,FOUR_WHEEL_DRIVE,FRANCHISE_APPROVED,STYLE,SUB_STYLE,HOURS,NUMBER_OF_BERTHS,AXLE,DEALER_REFERENCE,IMAGES,VIDEO_URL,DATE_OF_REGISTRATION,SERVICE_HISTORY
"27856","2c92999e6427610b01642c79c10e2869","23-Jun-2018","CARS","SE12BHZ","12","Peugeot","207","1.4 VTi Sportium 5dr","** SAT NAV AIR CON **","1397","CC","Petrol","2012","70575","M","Hatchback","Blue","Manual","5","2","3490","","Blue, ** TWO OWNERS ** SERVICE HISTORY ** SAT NAV ** LOW INSURANCE ** FANTASTIC MPG ** TWO KEYS ** METALLIC PAINT **GREAT FIRST CAR ** 12 MONTHS MOT ** BE QUICK TO VIEW THIS STUNNING EXAMPLE!!!! **, Upgrades - Metallic Paint, 2 owners, Standard Features - Air-Conditioning, Alloy Wheels (15in), Computer (Driver Information System), Electric Windows (Front), In Car Entertainment (Radio/CD/MP3), Satellite Navigation, Tinted Glass (Rear Windows). 5 seats, ALL VEHICLES HPI CHECKED AND NO DEPOSIT LOW RATE FINANCE AVAILABLE. BUY WITH CONFIDENCE, £3,490","","","","","","","","","","","","http://pictures2.autotrader.co.uk/imgser-uk/servlet/media?id=0ed99d2fc51a48ac92abf299d277727b,http://pictures2.autotrader.co.uk/imgser-uk/servlet/media?id=6b4d4c31ca094567b26c917cba3f8d0c,http://pictures2.autotrader.co.uk/imgser-uk/servlet/media?id=85fd867ac18c488db842b51c254fdd81,http://pictures2.autotrader.co.uk/imgser-uk/servlet/media?id=23300cfd59d243e7983ca62f5a5dbdcb,http://pictures2.autotrader.co.uk/imgser-uk/servlet/media?id=89e162651d094b0185f7085dfeadfa6b,http://pictures2.autotrader.co.uk/imgser-uk/servlet/media?id=5c2b2dd61c1c4a88af6a148ee599f079,http://pictures2.autotrader.co.uk/imgser-uk/servlet/media?id=9bbb016882704169b4ee31cf6221c6b8,http://pictures2.autotrader.co.uk/imgser-uk/servlet/media?id=00e2564a21da4f6a9ff318f0998d3c74,http://pictures2.autotrader.co.uk/imgser-uk/servlet/media?id=8ddfbd2870dc48d6b149e4373d89308b,http://pictures2.autotrader.co.uk/imgser-uk/servlet/media?id=c1865d410b974d5792374b90077d38e7,http://pictures2.autotrader.co.uk/imgser-uk/servlet/media?id=91ef210cfd974e71ba5ccc47910d5a1b,http://pictures2.autotrader.co.uk/imgser-uk/servlet/media?id=4af3751e7634445eae258b3e7dd13b5d,http://pictures2.autotrader.co.uk/imgser-uk/servlet/media?id=73a3d45198244d2db0abbf4ddf3bbb7e,http://pictures2.autotrader.co.uk/imgser-uk/servlet/media?id=b5c583c1d84d4318944542d783656c49,http://pictures2.autotrader.co.uk/imgser-uk/servlet/media?id=aa417e9e98b446d1b0b69fc9316cb9c6,http://pictures2.autotrader.co.uk/imgser-uk/servlet/media?id=74348028b64e4bd3ac7605f36f974a19,http://pictures2.autotrader.co.uk/imgser-uk/servlet/media?id=2ff7a863266f42b6a9b16f9ed5ebc7d0,http://pictures2.autotrader.co.uk/imgser-uk/servlet/media?id=8dcc53bd3c5f4b79b878a1ce032c58cd,http://pictures2.autotrader.co.uk/imgser-uk/servlet/media?id=20956b76fa444b628e92b05a5218b1b3,http://pictures2.autotrader.co.uk/imgser-uk/servlet/media?id=a3922823534e4f02a38ca82c629df48c","","25-07-2012",""
"27856","2c9299d0646ed9f00164704dfddb1515","06-Jul-2018","CARS","NK63NLX","63","Honda","Civic","1.6 i-DTEC SE 5dr","**ONE OWNER AND HISTORY**","1596","CC","Diesel","2013","58405","M","Hatchback","Black","Manual","5","1","6999","","Black, FANTASTIC EXAMPLE WITH A SERVICE HISTORY TO COMPLIMENT CONSISTING OF FOUR STAMPS**LOW TAX....ONLY £0 PER YEAR**SUPERB MPG**TWO KEYS**, Upgrades - Metallic Paint, 1 owner, Service history, Standard Features - Air-Conditioning (Automatic), Alarm, Alloy Wheels (16in), Electric Windows (Front/Rear), Hill Holder, In Car Entertainment (Radio/CD), Whiplash Protection System. 5 seats, ALL VEHICLES HPI CHECKED AND NO DEPOSIT LOW RATE FINANCE AVAILABLE. BUY WITH CONFIDENCE, £6,999","","","","","","","","","","","","http://pictures2.autotrader.co.uk/imgser-uk/servlet/media?id=3358ee5b95f345e2bb3a0002faf7b5d0,http://pictures2.autotrader.co.uk/imgser-uk/servlet/media?id=9ecbf2c8298346ba81aaf35d29db0f12,http://pictures2.autotrader.co.uk/imgser-uk/servlet/media?id=99fc3f451a7843059a2fec744111ca17,http://pictures2.autotrader.co.uk/imgser-uk/servlet/media?id=1ae981c6ac944feb8ebd14ea0b9be160,http://pictures2.autotrader.co.uk/imgser-uk/servlet/media?id=289930e2df3547a993a7a8e0fcf757af,http://pictures2.autotrader.co.uk/imgser-uk/servlet/media?id=4532713be489421181e0ffad7f377c7e,http://pictures2.autotrader.co.uk/imgser-uk/servlet/media?id=4ae8b43d817a430290792bc865db7fa7,http://pictures2.autotrader.co.uk/imgser-uk/servlet/media?id=4207498bef194e18866ce4a61bc56cc9,http://pictures2.autotrader.co.uk/imgser-uk/servlet/media?id=adcfe8150b7a46a9998c6b215a1e0792,http://pictures2.autotrader.co.uk/imgser-uk/servlet/media?id=cf3bd811d34c4f7383ee046c97f6b75f,http://pictures2.autotrader.co.uk/imgser-uk/servlet/media?id=f89b2bdc757546bca071a60711d02b76,http://pictures2.autotrader.co.uk/imgser-uk/servlet/media?id=18efe594f3e74bb18ae153577723e8e6,http://pictures2.autotrader.co.uk/imgser-uk/servlet/media?id=4947ff98d4944d8abd493142e9a4a926,http://pictures2.autotrader.co.uk/imgser-uk/servlet/media?id=e5192e57763442b99777e3a2b9d6319e,http://pictures2.autotrader.co.uk/imgser-uk/servlet/media?id=32e214d5716f4e18aadbc8f13c59e9c4,http://pictures2.autotrader.co.uk/imgser-uk/servlet/media?id=ef3da5e71c034d70a37ece8aa49b5f1f,http://pictures2.autotrader.co.uk/imgser-uk/servlet/media?id=d8571240a7584eb4b3bf0e01133fc9b4,http://pictures2.autotrader.co.uk/imgser-uk/servlet/media?id=8926d2c5de084f0793fab8428e7cd9ef,http://pictures2.autotrader.co.uk/imgser-uk/servlet/media?id=5760c40c6d1b4a9ebfa018dbbc3577b7,http://pictures2.autotrader.co.uk/imgser-uk/servlet/media?id=2916766834314b7b8ce928f0c288a959","","26-09-2013","Service history"
"27856","2c9299d16620a62d0166257ecb2137d5","29-Sep-2018","CARS","SG12EZM","12","BMW","5 Series","3.0 535d M Sport 4dr","ONE OWNER AND HISTORY","2993","CC","Diesel","2012","38255","M","Saloon","","Automatic","4","1","17999","","**A superb example of this BMW with a service history to compliment**SUPERB HIGH SPECIFICATION*ONLY ONE OWNER*VISIBILITY PACKAGE*HEADS UP DISPLAY WITH SPEED LIMIT MONITOR*BMW PROFESSIONAL MULTIMEDIA PLUS PACKAGE*ADVANCED PARKING PACKAGE*VARIABLE DAMPER CONTROL*SPORT AUTOMATIC TRANSMISSION*INTERNET*, Upgrades - Sun Protection Glass, Alloy Wheels - 19in M Double 351M, Media Package - Professional Multimedia, Surround View, BMW Online, DAB Digital Radio, Enhanced Bluetooth Telephone Funct./Telematics, Sun Protection Glazing, USB/Audio Interface, Headlight Wash, Tyre Pressure Monitoring, Xenon Headlights, Navigation System - BMW Professional Multimedia, Advanced Parking Package, Visibility Package, Head-up Display, Speed Limit Display, 1 owner, Standard Features - Air Conditioning, Automatic with Extended Features, Alarm System, Alarm System (Thatcham 1) with Remote Control, Automatic Air-Conditioning - Extended Features, BMW Professional Radio with Single CD Player (with MP3 Playback Capability), Bluetooth Telephone Preparation, Cruise Control with Brake Function and Speed Limiting Function, Electric Windows - Front and Rear, with Open/Close Fingertip Control, Anti - Trap Facility and Comfort Opening/Closing Function All Round, Enhanced Bluetooth Telephone Functionality, Heated Seats, Front, Hill - Start Assistant, Keyless Starting of Engine Ignition - Start/Stop Button, On - Board Computer (OBC), Park Assist, Park Distance Control (PDC), Front and Rear, Rain Sensor, Seat Heating, Front, Standard Seats - Front, Part - Electric Adjustment, Tyre Puncture Warning System (TPWS), USB Audio Interface, Upholstery - Dakota Leather, Windows - Heat - Insulated, Tinted All Round, Metallic Paintwork. 5 seats, ALL VEHICLES HPI CHECKED AND NO DEPOSIT LOW RATE FINANCE AVAILABLE. BUY WITH CONFIDENCE, £17,999","","","","","","","","","","","","http://pictures2.autotrader.co.uk/imgser-uk/servlet/media?id=237cd7bc8f6b457b8ed70d3b51a4d08a,http://pictures2.autotrader.co.uk/imgser-uk/servlet/media?id=73b6d4ff3ec941128c843fd2ac194317,http://pictures2.autotrader.co.uk/imgser-uk/servlet/media?id=fa64d24dd2f042f08e32d7a5588674f0,http://pictures2.autotrader.co.uk/imgser-uk/servlet/media?id=a4b2901986ce477187647cba3bb196bf,http://pictures2.autotrader.co.uk/imgser-uk/servlet/media?id=06daf60b0a6c47949ab827194a34f963,http://pictures2.autotrader.co.uk/imgser-uk/servlet/media?id=4d3579d0347c481eaf1a3d5cb7aaec6f,http://pictures2.autotrader.co.uk/imgser-uk/servlet/media?id=21f5ad053aba4f3bb4d0eee97cc4dda2,http://pictures2.autotrader.co.uk/imgser-uk/servlet/media?id=650f239f0d744d7aaaf4d0d79718cc23,http://pictures2.autotrader.co.uk/imgser-uk/servlet/media?id=f7a1a0b3828a4540828a2c98d33d6c26,http://pictures2.autotrader.co.uk/imgser-uk/servlet/media?id=3f0233a621c74879aeaaa5f68a49b9d9,http://pictures2.autotrader.co.uk/imgser-uk/servlet/media?id=6f319dd4e67e4702bf054103cbd61ff8,http://pictures2.autotrader.co.uk/imgser-uk/servlet/media?id=4ed5889d7df44ecd86403a46449f18dd,http://pictures2.autotrader.co.uk/imgser-uk/servlet/media?id=abdccc4ae8164d20815f00f9af511076,http://pictures2.autotrader.co.uk/imgser-uk/servlet/media?id=c04f0d308efe4e168c70b09e0babf59e,http://pictures2.autotrader.co.uk/imgser-uk/servlet/media?id=61c3ca5ba52a4b1cafb326f032538d5d,http://pictures2.autotrader.co.uk/imgser-uk/servlet/media?id=80d1133443ab4ab8b5bf6426372d9904,http://pictures2.autotrader.co.uk/imgser-uk/servlet/media?id=d7a96da4c4044b9a83713725adb1710e,http://pictures2.autotrader.co.uk/imgser-uk/servlet/media?id=762e4b8a3ad54724af1e664191746063,http://pictures2.autotrader.co.uk/imgser-uk/servlet/media?id=626c7a85c1b94ab8ada647e4922fa32f,http://pictures2.autotrader.co.uk/imgser-uk/servlet/media?id=8647d47e7a4447e49b8210b0bb12a53f","","01-03-2012",""
"27856","2c9299d1643ce184016450c0d03f6258","30-Jun-2018","CARS","YY59AXT","59","Nissan","Qashqai","1.6 Acenta 2WD 5dr","*ALLOYS * CLIMATE * BLUETOOTH*","1598","CC","Petrol","2009","72185","M","Hatchback","Grey","Manual","5","2","4799","","Grey, ***** 12 MONTHS MOT ***** COMPREHENSIVE PARTS AND LABOUR WARRANTY *****A fantastic example of this popular FAMILY HATCH with a service history to compliment consisting of SEVEN STAMPS., Upgrades - Metallic Paint, 2 owners, Service history, Standard Features - Alarm, Alloy Wheels, Climate Control, Cruise Control, Electric Windows (Front/Rear), In Car Entertainment (Radio/CD Autochanger), Parking Aid (Rear), Telephone Equipment, Air Bag Driver, Air Bag Passenger, Alloy wheels, CD Player, Electric windows, Cruise control, Parking aid, Immobiliser, Trip Computer, Windscreen Wiper, Seat Height Adjustment. 5 seats, ALL VEHICLES HPI CHECKED AND NO DEPOSIT LOW RATE FINANCE AVAILABLE. BUY WITH CONFIDENCE, £4,799","","","","","","","","","","","","http://pictures2.autotrader.co.uk/imgser-uk/servlet/media?id=5ac21fbcf5344877855cb35bac477e57,http://pictures2.autotrader.co.uk/imgser-uk/servlet/media?id=146a2d90db7847728ae5faaf0f317ed7,http://pictures2.autotrader.co.uk/imgser-uk/servlet/media?id=dea81d4cdbf04842be432d364325c427,http://pictures2.autotrader.co.uk/imgser-uk/servlet/media?id=fbe5342df03a47cc9cd79915df1c40f6,http://pictures2.autotrader.co.uk/imgser-uk/servlet/media?id=169711660281464a97b3ba8ae9d92af6,http://pictures2.autotrader.co.uk/imgser-uk/servlet/media?id=440fccf495884ae489413eb933107037,http://pictures2.autotrader.co.uk/imgser-uk/servlet/media?id=5d80ecd73e6149cdbe529dce678e34bc,http://pictures2.autotrader.co.uk/imgser-uk/servlet/media?id=498fbaacef304c7fb5fc12048bbf6303,http://pictures2.autotrader.co.uk/imgser-uk/servlet/media?id=f01068ccaef24a40923dec033b9e3c7a,http://pictures2.autotrader.co.uk/imgser-uk/servlet/media?id=661975cce698469bbdd92e18d15fc172,http://pictures2.autotrader.co.uk/imgser-uk/servlet/media?id=24df6bab27b24ffd914753dfa2d82520,http://pictures2.autotrader.co.uk/imgser-uk/servlet/media?id=5b33b65309b8439db9614e55cc9d0374,http://pictures2.autotrader.co.uk/imgser-uk/servlet/media?id=03c2d364b3584dc89649405ff6e50b58,http://pictures2.autotrader.co.uk/imgser-uk/servlet/media?id=eb3a3f0ccf6a4c90a8584526379781dd,http://pictures2.autotrader.co.uk/imgser-uk/servlet/media?id=a4941c5dc7af4c7795c0f15709374e34,http://pictures2.autotrader.co.uk/imgser-uk/servlet/media?id=4e174b9af78a4db0b5961d837c66f8c5,http://pictures2.autotrader.co.uk/imgser-uk/servlet/media?id=50fc2fcf140148aebcb7d109911ad066,http://pictures2.autotrader.co.uk/imgser-uk/servlet/media?id=c92f224553c74b9291c7653c3ab3023a,http://pictures2.autotrader.co.uk/imgser-uk/servlet/media?id=322adb19b2884d8a96a6a4ff064deb8d,http://pictures2.autotrader.co.uk/imgser-uk/servlet/media?id=4616cbe67ea443bc940319cda724d5fd","","24-09-2009","Service history"
"27856","2c9299d06620a4fb01663a5781fb2d6e","03-Oct-2018","CARS","NV62PXR","62","Vauxhall","Antara","2.2 CDTi SE AWD (s/s) 5dr (Nav)","**TWO OWNERS AND HISTORY**","2231","CC","Diesel","2013","55505","M","SUV","White","Manual","5","2","7499","","White, A superb example of this popular VAUXHALL 4X4 with a service history to compliment consisting of FOUR STAMPS**, 2 owners, Service history, 19in Alloy Wheels, Cruise Control, Dark-Tinted Glass (Excludes Windscreen and Front Door Windows) and Tinted Glass (Windscreen and Front Door Windows), Dual-Zone Electronic Climate Control (ECC), Electrically Heated Front Seats with Variable Temperature Settings, Electrically Operated Front and Rear Windows with Safety Autoreverse and One-Touch Facility, Front and Rear Parking Distance Sensors, Rain-Sensitive Windscreen Wipers, Remote Control Ultrasonic Security Alarm System, Start/Stop System, Tyre Pressure Monitoring System, Upholstery Leather - Leather Charcoal with Leather Seat Facings. 5 seats, ALL VEHICLES HPI CHECKED AND NO DEPOSIT LOW RATE FINANCE AVAILABLE. BUY WITH CONFIDENCE, £7,499","","","","","","","","","","","","http://pictures2.autotrader.co.uk/imgser-uk/servlet/media?id=5d48b3ecea5c49f18d4cdcede31d0607,http://pictures2.autotrader.co.uk/imgser-uk/servlet/media?id=561a2ccf58084d40947a63202a82c6c4,http://pictures2.autotrader.co.uk/imgser-uk/servlet/media?id=6c66be6aae7f4877855d5c1c5e9891d0,http://pictures2.autotrader.co.uk/imgser-uk/servlet/media?id=cd17d40c86f34f8d8945585b5028483f,http://pictures2.autotrader.co.uk/imgser-uk/servlet/media?id=6e4d7340e304498ea02a15f4dc638e67,http://pictures2.autotrader.co.uk/imgser-uk/servlet/media?id=2c5c20386fd449f7ac7b5db0cfd14890,http://pictures2.autotrader.co.uk/imgser-uk/servlet/media?id=873f33f6c7744c5e91db4bb4976afafb,http://pictures2.autotrader.co.uk/imgser-uk/servlet/media?id=4e145e7e420f4703b620267c2b922449,http://pictures2.autotrader.co.uk/imgser-uk/servlet/media?id=811145658aa544839738db3d92bc9f41,http://pictures2.autotrader.co.uk/imgser-uk/servlet/media?id=4a400fb364ce4354867b8fa0554cf9f8,http://pictures2.autotrader.co.uk/imgser-uk/servlet/media?id=a05d98ae818f4ffb9d1cf8f264356c58,http://pictures2.autotrader.co.uk/imgser-uk/servlet/media?id=5d80ecd73e6149cdbe529dce678e34bc,http://pictures2.autotrader.co.uk/imgser-uk/servlet/media?id=2f521d5e01274f12a8986f467356fc2b,http://pictures2.autotrader.co.uk/imgser-uk/servlet/media?id=351757bc646c417ab431174cf7a4d17f,http://pictures2.autotrader.co.uk/imgser-uk/servlet/media?id=db249129151c493dbd1d84a87abfc3e8,http://pictures2.autotrader.co.uk/imgser-uk/servlet/media?id=c0f591921c37479bb3f294102ee8ab0f,http://pictures2.autotrader.co.uk/imgser-uk/servlet/media?id=73b1ccb542254532b51257d86693f2bf,http://pictures2.autotrader.co.uk/imgser-uk/servlet/media?id=dea81d4cdbf04842be432d364325c427,http://pictures2.autotrader.co.uk/imgser-uk/servlet/media?id=28e7236d3892414fa08b549bdbb61f1f,http://pictures2.autotrader.co.uk/imgser-uk/servlet/media?id=6b148cb2c9fb46868046730ff4871c08","","28-01-2013","Service history"
"27856","2c9299cf63ac2a990163baf201137717","01-Jun-2018","CARS","NL62MUY","62","Volkswagen","up!","1.0 Move up! 3dr","**ONE OWNER AND VW HISTORY**","999","CC","Petrol","2012","94690","M","Hatchback","Red","Manual","3","1","3599","","Red, **ONE OWNER**FULL VW HISTORY CONSISTING OF NINE STAMPS!!!!**£20 ROAD TAX**FANTASTIC MPG**LOW INSURANCE**SUPERB FIRST CAR**DO NOT MISS OUT ON THIS ONE OFF!!!!!!!!!**, 1 owner, Air Conditioning, Manual, Heat Insulating Green Tinted Glass, RCD 215 Radio/MP3 Compatible CD Player, Front and AUX-in Socket for Connection to an External Multimedia Source. 4 seats, ALL VEHICLES HPI CHECKED AND NO DEPOSIT LOW RATE FINANCE AVAILABLE. BUY WITH CONFIDENCE, £3,599","","","","","","","","","","","","http://pictures2.autotrader.co.uk/imgser-uk/servlet/media?id=a50f266e9f7d43fc8c31fffc0e665ec2,http://pictures2.autotrader.co.uk/imgser-uk/servlet/media?id=43be154a9aab4a76bd684dac1c5443ad,http://pictures2.autotrader.co.uk/imgser-uk/servlet/media?id=b341e4da21d44540bb5a913fdf0b401f,http://pictures2.autotrader.co.uk/imgser-uk/servlet/media?id=47bd1191ad05405d8b5de1e0e30f9a00,http://pictures2.autotrader.co.uk/imgser-uk/servlet/media?id=7a27e799d7e0417aae56d7d3f67e5bdf,http://pictures2.autotrader.co.uk/imgser-uk/servlet/media?id=980c304a3a3a404fadb0a102a6b54e7a,http://pictures2.autotrader.co.uk/imgser-uk/servlet/media?id=802db1745cdb4ea59bcab1ecf10895fb,http://pictures2.autotrader.co.uk/imgser-uk/servlet/media?id=3b1041775c934c4998af26addec0acc2,http://pictures2.autotrader.co.uk/imgser-uk/servlet/media?id=90c49273dfa1456691435af623b00bd6,http://pictures2.autotrader.co.uk/imgser-uk/servlet/media?id=697d9689687141a38b3ba43cab111fd0,http://pictures2.autotrader.co.uk/imgser-uk/servlet/media?id=8493d9824e2544ae8791d9a7ee495d60,http://pictures2.autotrader.co.uk/imgser-uk/servlet/media?id=53435b09088148118ee4de913f118488,http://pictures2.autotrader.co.uk/imgser-uk/servlet/media?id=d0b1fb73069b4a20ab95130262a88fa6,http://pictures2.autotrader.co.uk/imgser-uk/servlet/media?id=ffdd817c91e04edb9a4e6443fd48f433,http://pictures2.autotrader.co.uk/imgser-uk/servlet/media?id=2bbd192a82a54ac28eaa2c43a19c3c39,http://pictures2.autotrader.co.uk/imgser-uk/servlet/media?id=25ffef7738a3474d881453aa2b700288,http://pictures2.autotrader.co.uk/imgser-uk/servlet/media?id=42da29de66f84d75b438d6c2c7445639,http://pictures2.autotrader.co.uk/imgser-uk/servlet/media?id=08cbc9d1a5164894a02c1c43f7914a51,http://pictures2.autotrader.co.uk/imgser-uk/servlet/media?id=bc4461ab1c4b4dc883330c8948fcf66a,http://pictures2.autotrader.co.uk/imgser-uk/servlet/media?id=defa78e5d79b4d7aaf6f60365bd12823","","07-09-2012",""
"27856","2c9299d2667a754c01667d0731230b22","16-Oct-2018","CARS","SO08VAF","08","Volkswagen","Tiguan","2.0 TDI SE 4MOTION 5dr","**TWO OWNERS AND HISTORY**","1968","CC","Diesel","2008","42065","M","SUV","Silver","Manual","5","2","7999","","Silver, A superb TWO OWNER example of this unique specification VOLKSWAGEN TIGUAN with a service history to compliment consisting of FIVE STAMPS**LEATHER SEATS**METALLIC PAINT**HEATED SEATS**ELECTRIC SEATS**REAR PARKING SENSORS**, Upgrades - Leather Upholstery, Electric Seats, Heated Seats, Special Paint, 2 owners, Service history, Standard Features - Air-Conditioning, Alarm, Alloy Wheels (17in), Computer (Driver Information System), Electric Windows (Front/Rear), In Car Entertainment (Radio/CD/MP3/CD Autochanger), Tinted Glass, Tyre Pressure Control, Heat Insulating Tinted Glass. 5 seats, ALL VEHICLES HPI CHECKED AND NO DEPOSIT LOW RATE FINANCE AVAILABLE. BUY WITH CONFIDENCE, £7,999","","","","","","","","","","","","http://pictures2.autotrader.co.uk/imgser-uk/servlet/media?id=d72da571c0b34ab08d69cfab19436973,http://pictures2.autotrader.co.uk/imgser-uk/servlet/media?id=d5661e6ceac9425dbf8be1b19516c0c7,http://pictures2.autotrader.co.uk/imgser-uk/servlet/media?id=32a1c975101e46f0851955118289793d,http://pictures2.autotrader.co.uk/imgser-uk/servlet/media?id=c56a38b038474423a2d4c78713bdf795,http://pictures2.autotrader.co.uk/imgser-uk/servlet/media?id=a5f4c806c57c49539da93e04fe2b335d,http://pictures2.autotrader.co.uk/imgser-uk/servlet/media?id=e977106d6e514da28a6c498ca11bac21,http://pictures2.autotrader.co.uk/imgser-uk/servlet/media?id=9b8e46381e57423d926e5fe99cba2a0b,http://pictures2.autotrader.co.uk/imgser-uk/servlet/media?id=c2a1d630ebac4976aa923c79b0800837,http://pictures2.autotrader.co.uk/imgser-uk/servlet/media?id=03c2d364b3584dc89649405ff6e50b58,http://pictures2.autotrader.co.uk/imgser-uk/servlet/media?id=7da0593bf6ac4a6b9aa8928780d43341,http://pictures2.autotrader.co.uk/imgser-uk/servlet/media?id=da16d4c10f1c49f2ab6bf0a64455a793,http://pictures2.autotrader.co.uk/imgser-uk/servlet/media?id=14af35e8e3764997868f75ae460f1180,http://pictures2.autotrader.co.uk/imgser-uk/servlet/media?id=90548eaa1e1742e69684e7745a264289,http://pictures2.autotrader.co.uk/imgser-uk/servlet/media?id=6d2175cc19a5486198a973759cfbbd31,http://pictures2.autotrader.co.uk/imgser-uk/servlet/media?id=6c66be6aae7f4877855d5c1c5e9891d0,http://pictures2.autotrader.co.uk/imgser-uk/servlet/media?id=1d06760f63d644c7a7dbe52aaf3eb3ab,http://pictures2.autotrader.co.uk/imgser-uk/servlet/media?id=24f47801b4954ad0a1ec9eb8c481efd3,http://pictures2.autotrader.co.uk/imgser-uk/servlet/media?id=abc59edd1b974705ae7cfbbd0beac532,http://pictures2.autotrader.co.uk/imgser-uk/servlet/media?id=e4c2e3a7d4684c5fa1c641d92f74f572,http://pictures2.autotrader.co.uk/imgser-uk/servlet/media?id=c8a785f9538448808b32ee247f2df608","","01-03-2008","Service history"
"27856","2c92999f628fff0001629bd9e8d41394","06-Apr-2018","CARS","MF11PDV","11","Ford","Fiesta","1.6 S1600 3dr","**FULL LEATHER SEATS**","1596","CC","Petrol","2011","54705","M","Hatchback","Blue","Manual","3","","5599","","Blue, **FANTASTIC EXAMPLE OF THIS RARE VEHICLE WITH A SERVICE HISTORY TO COMPLIMENT CONSISTING OF FIVE STAMPS**BE QUICK AND DO NOT MISS OUT, BOOK A TEST DRIVE!!!!**, Upgrades - Unique Paint -Performance Blue, Service history, Standard Features - ATC Air Conditioning, Leather Pack Titanium, Perimeter Alarm. 5 seats, ALL VEHICLES HPI CHECKED AND NO DEPOSIT LOW RATE FINANCE AVAILABLE. BUY WITH CONFIDENCE, £5,599","","","","","","","","","","","","http://pictures2.autotrader.co.uk/imgser-uk/servlet/media?id=b3f01c1d676e4e1093aebd2b6cee522b,http://pictures2.autotrader.co.uk/imgser-uk/servlet/media?id=50578e8094904e02b1bcbdbe2ada2460,http://pictures2.autotrader.co.uk/imgser-uk/servlet/media?id=cf9dcaccc3724b0e992e04248cec5112,http://pictures2.autotrader.co.uk/imgser-uk/servlet/media?id=6445c9df9b8a402d898a1d553f3c8cbd,http://pictures2.autotrader.co.uk/imgser-uk/servlet/media?id=b469b8f713af45559b5e42684fa84e27,http://pictures2.autotrader.co.uk/imgser-uk/servlet/media?id=02f7d0d538ec4800a2cb86b3ed098896,http://pictures2.autotrader.co.uk/imgser-uk/servlet/media?id=364cfaa0474144fba67373f347712384,http://pictures2.autotrader.co.uk/imgser-uk/servlet/media?id=4207498bef194e18866ce4a61bc56cc9,http://pictures2.autotrader.co.uk/imgser-uk/servlet/media?id=cd08cdeab87541a994c0b8002cf9d295,http://pictures2.autotrader.co.uk/imgser-uk/servlet/media?id=fdd137c49a1a40848e7428782c3b8627,http://pictures2.autotrader.co.uk/imgser-uk/servlet/media?id=8926d2c5de084f0793fab8428e7cd9ef,http://pictures2.autotrader.co.uk/imgser-uk/servlet/media?id=6f10ee4c470c4d8ca59cabb04f196108,http://pictures2.autotrader.co.uk/imgser-uk/servlet/media?id=cf3bd811d34c4f7383ee046c97f6b75f,http://pictures2.autotrader.co.uk/imgser-uk/servlet/media?id=467205e35d8e4357a0adc241803ef7ea,http://pictures2.autotrader.co.uk/imgser-uk/servlet/media?id=52766c47772a40468d453d74e7d560c7,http://pictures2.autotrader.co.uk/imgser-uk/servlet/media?id=22d6d4e5da1347ce8ce08426d3762d01,http://pictures2.autotrader.co.uk/imgser-uk/servlet/media?id=8bbb7efed15d42a7b82d4e3bfa9577fa,http://pictures2.autotrader.co.uk/imgser-uk/servlet/media?id=4947ff98d4944d8abd493142e9a4a926,http://pictures2.autotrader.co.uk/imgser-uk/servlet/media?id=1f69d01b3ddc45a28736963c37199c91,http://pictures2.autotrader.co.uk/imgser-uk/servlet/media?id=7c7bb3fa5e1f4a3eb44785ba63ce5834","","10-03-2011","Service history"
